{
  "schema": "company-os.release-scope-admission.v1",
  "record_version": 1,
  "admission_id": "example-program-scope-1",
  "decision": "admitted_pre_dispatch",
  "bindings": {
    "project_id": "example-project",
    "program_id": "example-program",
    "program_version": 1,
    "definition_version": 1,
    "cycle_id": "example-cycle-1",
    "master_task_id": "example-master-1",
    "outcome_digest": "0000000000000000000000000000000000000000000000000000000000000000",
    "scope_definition_sha256": "0000000000000000000000000000000000000000000000000000000000000000",
    "predecessor_admission_sha256": "0000000000000000000000000000000000000000000000000000000000000000",
    "accepted_design_decision_sha256": "0000000000000000000000000000000000000000000000000000000000000000"
  },
  "accepted_design_decision": {
    "path": "evidence/release-scope-design-decision.v1.json",
    "sha256": "0000000000000000000000000000000000000000000000000000000000000000"
  },
  "authentication": {
    "scheme": "company-os.rsa-3072-sha256-pkcs1-v1_5.v1",
    "key_id": "example-master-key-1",
    "public_key_sha256": "0000000000000000000000000000000000000000000000000000000000000000",
    "signature": "AAAAAAAAAAAAAAAAAAAAAAAAAAAAAAAAAAAAAAAAAAAAAAAAAAAAAAAAAAAAAAAAAAAAAAAAAAAAAAAAAAAAAAAAAAAAAAAAAAAAAAAAAAAAAAAAAAAAAAAAAAAAAAAAAAAAAAAAAAAAAAAAAAAAAAAAAAAAAAAAAAAAAAAAAAAAAAAAAAAAAAAAAAAAAAAAAAAAAAAAAAAAAAAAAAAAAAAAAAAAAAAAAAAAAAAAAAAAAAAAAAAAAAAAAAAAAAAAAAAAAAAAAAAAAAAAAAAAAAAAAAAAAAAAAAAAAAAAAAAAAAAAAAAAAAAAAAAAAAAAAAAAAAAAAAAAAAAAAAAAAAAAAAAAAAAAAAAAAAAAAAAAAAAAAAAAAAAAAAAAAAAAAAAAAAAAAAAAAAAAAAAAAAAAAAAAAAAAAAAAAAAAAAAAAAAAAAAAAAAAAAAAAAAAAAAAAAAAAAAAAAAAAAAAAAAAAAAAAAAAAAAAAAAAAAAAAAAAAAAAAAAAAAAAAAAA"
  }
}
